guid,question,answer,paper_title,paper_url,explanation,tags
si7^W!/<>,"What is the computational cost of a standard convolution with input&nbsp;\(h_i \times w_i \times d_i\), output \(h_i \times w_i \times d_j\) and kernel size \(k\)?",\(h_i \times w_i \times d_i \times d_j \times k \times k\)<br>,MobileNets: Efficient Convolutional Neural Networks for Mobile Vision Applications,https://arxiv.org/abs/1704.04861,,
"lQ_1X1b,qX","What is the <u>computational cost</u> of a <b>depthwise separabale convolution</b> with input&nbsp;\(h_i \times w_i \times d_i\), output \(h_i \times w_i \times d_j\) and kernel size \(k\)?",\(h_i \cdot w_i \cdot d_i (k^2 + d_j) \),MobileNets: Efficient Convolutional Neural Networks for Mobile Vision Applications,https://arxiv.org/abs/1704.04861,,
u<LF`Q^|:w,How much<b> reduction in computation</b> do you get by replacing standard convolutions with depthwise separable convolutions?,"<div><b>Computational&nbsp;cost standard convolution</b>:<br></div><div>\(h_i \times w_i \times d_i \times d_j \times k \times k\)<br></div><b>Computational cost depthwise separable convolution</b>:<div>\(h_i \cdot w_i \cdot d_i (k^2 + d_j) \)<br></div><div>with input&nbsp;\(h_i \times w_i \times d_i\), output \(h_i \times w_i \times d_j\) and kernel size \(k\)<br></div><div><b>Reduction:</b></div><div>\(= \frac{h_i \cdot w_i \cdot d_i (k^2 + d_j)}{h_i \times w_i \times d_i \times d_j \times k \times k}\)</div><div>\(= \frac{1}{d_j} + \frac{1}{k^2}\)</div>",MobileNets: Efficient Convolutional Neural Networks for Mobile Vision Applications,https://arxiv.org/abs/1704.04861,MobileNet uses \(3 \times 3\) depthwise separable convolutions which uses between 8 to 9 times less computation than standard convolutions.,
MxBi+I#@1k,"With what does <b>MobileNet replace the standard convolutional layer</b> with batchnorm and ReLU?<div><img src=""paste-30e8601affa2d6483ff09e78c38f234cdfcdaaee.jpg""><br></div>","With a <b>Depthwise Separable convolutions</b> with Depthwise and Pointwise layers followed by batchnorm and ReLU.<div><img src=""paste-5e4779b76090a08c9ae193dbb7b515d911d52821.jpg""><br></div>",MobileNets: Efficient Convolutional Neural Networks for Mobile Vision Applications,https://arxiv.org/abs/1704.04861,,
s3!P5k8M-c,Which two <b>additional hyperparameters</b> are introduced in <b>MobileNet </b>to construct scaled versions of the standard architecture?,"<b><u>Width multiplier:</u></b><div>The role of the <b>width multiplier \(\alpha\)</b> is to <b>thin a network uniformly at each layer</b>. For a given layer and width multiplier \(\alpha\), the number of input channels \(d_i\) becomes \(\alpha d_i\) and the number of output channels \(d_j\) becomes \(\alpha d_j\).</div><div>Width multiplier has the effect of <b>reducing computational cost</b> and the number of parameters&nbsp;quadratically <b>by roughly \(\alpha^2\)</b>.<br></div><div><br></div><div><b><u>Resolution multiplier:</u></b></div><div>The resolution multiplier \(\rho\) is applied to the input image and the internal representation of every layer is subsequently reduced by the same multiplier. <i>In practice we implicitly set \(\rho\) by setting the input resolution.</i></div><div>Resolution multiplier has the effect of <b>reducing computational cost by \(\rho^2\)</b>.<i><br></i></div>",MobileNets: Efficient Convolutional Neural Networks for Mobile Vision Applications,https://arxiv.org/abs/1704.04861,,
b3}B]ZIL=D,How many multiply-adds and parameters does the default&nbsp;<b>MobileNet</b>V1 have? And how much accuracy does it get on ImageNet?,<b>569M MAdds</b> and <b>4.2M parameters</b> with an accuracy of <b>70.6%</b> on ImageNet.,MobileNets: Efficient Convolutional Neural Networks for Mobile Vision Applications,https://arxiv.org/abs/1704.04861,,
